Record,PanelId,PanelCode,PanelRuleCode,PanelRuleName,MinSeverity,MaxSeverity,RevisedSummary,SummaryVariantCode
80,8,DIA,DIA_DM_VERY_POOR,Diabetes Very Poor Control,8,8,The findings show severely elevated blood sugar levels suggesting very poor diabetic control. Impaired glucose regulation at this stage may lead to complications affecting several organ systems. Immediate medical review and comprehensive diabetes management are essential.,
81,9,DIA,DIA_DM_CRITICAL,Diabetes Critical Hyperglycemia,9,9,"Your glucose levels are extremely elevated, indicating a potentially critical metabolic condition. Such levels significantly increase the risk of serious complications including diabetic ketoacidosis or hyperosmolar hyperglycemic state. Immediate medical evaluation and urgent treatment are required.",
82,9,DIA,DIA_DM_CRITICAL,Diabetes Critical Hyperglycemia,9,9,"The current results show dangerously high blood sugar levels, suggesting a critical diabetic state. These levels may lead to severe complications such as diabetic ketoacidosis or hyperosmolar hyperglycemic syndrome. Urgent medical attention is strongly recommended.",
83,9,DIA,DIA_DM_CRITICAL,Diabetes Critical Hyperglycemia,9,9,Your blood sugar levels are critically high and may indicate a serious metabolic emergency. This stage carries an increased risk of conditions such as diabetic ketoacidosis or hyperosmolar hyperglycemic state. Immediate medical care is essential.,
84,9,DIA,DIA_DM_CRITICAL,Diabetes Critical Hyperglycemia,9,9,"The glucose readings are dangerously elevated, indicating a potentially life-threatening diabetic condition. Such levels may result in acute complications including diabetic ketoacidosis or hyperosmolar hyperglycemia. Immediate medical intervention is required.",
85,9,DIA,DIA_DM_CRITICAL,Diabetes Critical Hyperglycemia,9,9,Your results indicate critically high glucose levels that may represent a severe diabetic emergency. These levels are associated with a high risk of complications such as diabetic ketoacidosis or hyperosmolar hyperglycemic state. Prompt medical treatment is urgently needed.,
86,9,DIA,DIA_DM_CRITICAL,Diabetes Critical Hyperglycemia,9,9,"The findings show extremely elevated blood sugar levels, suggesting a critical diabetic condition. Without urgent medical intervention, complications such as diabetic ketoacidosis or hyperosmolar hyperglycemia may occur. Immediate clinical care is required.",
87,9,DIA,DIA_DM_CRITICAL,Diabetes Critical Hyperglycemia,9,9,Your glucose levels are severely elevated and may represent a medical emergency. This stage is associated with a high risk of acute complications including diabetic ketoacidosis or hyperosmolar hyperglycemic syndrome. Immediate medical attention is essential.,
88,9,DIA,DIA_DM_CRITICAL,Diabetes Critical Hyperglycemia,9,9,The results indicate dangerously high blood sugar levels consistent with a potentially critical diabetic state. Such levels may lead to severe metabolic complications if not treated promptly. Urgent medical care is strongly advised.,
89,9,DIA,DIA_DM_CRITICAL,Diabetes Critical Hyperglycemia,9,9,"Your glucose profile shows critically elevated blood sugar levels, indicating a high-risk diabetic condition. This stage may lead to serious complications such as diabetic ketoacidosis or hyperosmolar hyperglycemic crisis. Immediate medical evaluation is necessary.",
90,9,DIA,DIA_DM_CRITICAL,Diabetes Critical Hyperglycemia,9,9,The current findings reveal extremely high glucose levels that may represent a life-threatening diabetic condition. The risk of severe complications such as diabetic ketoacidosis or hyperosmolar hyperglycemic state is significantly increased. Urgent medical treatment is required.,
